{
  "entry_id": "EV424-ENTRY-000006",
  "type": "doc_passport",
  "source": "NIST.SP.800-228.pdf",
  "url": "https://nvlpubs.nist.gov/nistpubs/SpecialPublications/NIST.SP.800-228.pdf",
  "issued_date": "2026-02-01T12:09:49+0900",
  "fingerprint_sha256": "9b018dd8b0cf21292898430681589d2263d6a74cb8d2dae1a1dea9bf0e77fd51",
  "result_rep_sha256": "7a01bc32b412cd1f50e503bc6e409624a2393ef11bcaf43b0dddcbefc002b718",
  "verify": {
    "local_sha": "OK",
    "src_record": "OK",
    "redownload": "OK",
    "chain": "OK"
  },
  "receipt_text": "==[EV424 FINAL RECEIPT]==\n\n01)\nLEGEND\nOK           SHA-256 verified (sha256sum -c PASS)\nPASS         Printed only when all required CHECKS are OK\nMODE         REPRO\n----------------------------------------\n\n02)\nIDENTITY\nSOURCE       NIST.SP.800-228.pdf\nISSUED_DATE  2026-02-01T12:09:49+0900\nFINGERPRINT  9b018dd8b0cf21292898430681589d2263d6a74cb8d2dae1a1dea9bf0e77fd51\nURL          https://nvlpubs.nist.gov/nistpubs/SpecialPublications/NIST.SP.800-228.pdf\nREVERIFY     +7d -> CONSISTENCY+REDOWNLOAD\n----------------------------------------\n\n03)\nVERIFY\nSTATUS       [OK] LOCAL_SHA  [OK] SRC_RECORD  [OK] REDOWNLOAD  [OK] CHAIN\n----------------------------------------\n\n04)\nRESULT\nPASS | sha256=7a01bc32b412cd1f50e503bc6e409624a2393ef11bcaf43b0dddcbefc002b718\n\nAccuracy(4)=Truth(2)=Life(4)\n"
}